<?xml version="1.0" encoding="UTF-8"?>

<!-- https://www.w3schools.com/xml/schema_intro.asp -->

<!--<proxy-config xmlns:xsi="http://www.w3.org/2001/XMLSchema-instance" xsi:noNamespaceSchemaLocation="proxy-config.xsd">-->

<proxy-config xmlns:xsi="http://www.w3.org/2001/XMLSchema-instance" xmlns="http://github.com/tfreese/maven-proxy/config"
              xsi:schemaLocation="http://github.com/tfreese/maven-proxy/config https://raw.githubusercontent.com/tfreese/maven-proxy/master/proxy-main/proxy-config.xml">

    <server-config>
        <port>7999</port>
        <thread-pool-core-size>2</thread-pool-core-size>
        <thread-pool-max-size>6</thread-pool-max-size>
        <thread-name-pattern>http-server-%d</thread-name-pattern>
    </server-config>

    <client-config>
        <thread-pool-core-size>2</thread-pool-core-size>
        <thread-pool-max-size>6</thread-pool-max-size>
        <thread-name-pattern>http-client-%d</thread-name-pattern>
    </client-config>

    <repositories>
        <remote>
            <name>maven-central</name>
            <url>https://repo1.maven.org/maven2</url>
        </remote>
        <remote>
            <name>spring-release</name>
            <url>https://repo.spring.io/release</url>
        </remote>
        <remote>
            <name>primefaces</name>
            <url>https://repository.primefaces.org</url>
        </remote>
        <remote>
            <name>gradle-releases</name>
            <url>https://repo.gradle.org/gradle/libs-releases</url>
        </remote>
        <remote>
            <name>gradle-plugins</name>
            <url>https://plugins.gradle.org/m2</url>
        </remote>
        <local>
            <name>third-party</name>
            <path>file:///tmp/maven-proxy/third-party</path>
        </local>
        <local writeable="true">
            <name>deploy-releases</name>
            <path>file:///tmp/maven-proxy/deploy-releases</path>
        </local>
        <local writeable="true">
            <name>deploy-snapshots</name>
            <path>file:///tmp/maven-proxy/deploy-snapshots</path>
        </local>
        <local writeable="true">
            <name>deploy-sites</name>
            <path>file:///tmp/maven-proxy/deploy-sites</path>
        </local>
        <virtual>
            <name>public</name>
            <repository-name>third-party</repository-name>
            <repository-name>maven-central</repository-name>
            <repository-name>spring-release</repository-name>
            <repository-name>primefaces</repository-name>
            <repository-name>gradle-releases</repository-name>
            <repository-name>gradle-plugins</repository-name>
            <repository-name>deploy-releases</repository-name>
            <repository-name>deploy-snapshots</repository-name>
        </virtual>
        <virtual>
            <name>public-local</name>
            <repository-name>third-party</repository-name>
            <repository-name>deploy-releases</repository-name>
            <repository-name>deploy-snapshots</repository-name>
        </virtual>
    </repositories>

    <file-cache enabled="true">
        <local-url>file:///tmp/maven-proxy/cache</local-url>
    </file-cache>

    <db-monitoring enabled="false">
        <jdbc-url>jdbc:string</jdbc-url>
    </db-monitoring>

</proxy-config>
